{
	"$schema": "https://schemas.pay-cex.io/api/v3/invoice/invoice.json",
	"currency": "USD",
	"amount": "145.45",
	"notes": "Per terms of agreement. Earn Crypto button.",
	"items": [
		{
			"description": "Earn Crypto button 1 : \"Earn Button, April 202X\"",
			"quantity": "4",
			"unitPrice": "25",
			"amount": "100"
		},
		{
			"description": "Earn Crypto button 2 : \"Earn Button, April 202X\"",
			"quantity": "3",
			"unitPrice": "15.15",
			"amount": "45.45"
		}
	]
}
